Number;Hydrophone;Type;SerialNumber;Sensitivity;FrequencyStart;FrequencyStop
H1;Bottom moored hydrophone No2;Naxys Ethernet Hydrophone model 02345;2;-179;5;300000
H2;Bottom moored hydrophone No3;Naxys Ethernet Hydrophone model 02345;3;-179;5;300000
H3;Sound trap;Ocean Instruments, sound trap 300;5513;-176.3;20;60000
H4;Vessel mounted hydrophone;reson TC4034;;-218;1;470000
H5;Vertical hydrophone array No4;Naxys Ethernet Hydrophone model 02345;4;-179;5;300000
H6;Vertical hydrophone array No5;Naxys Ethernet Hydrophone model 02345;5;-179;5;300000
H7;icListen;Ocean Sonics, SC35ETH icListen HF;1758;168.3;10;200000
H8;;Naxys Ethernet Hydrophone model 02345;19;-179;5;300000
